{
  "hit_id": "550e8400-e29b-41d4-a716-446655440101",
  "knowledge_base_id": "550e8400-e29b-41d4-a716-446655440010",
  "document_id": "550e8400-e29b-41d4-a716-446655440020",
  "document_version_id": "550e8400-e29b-41d4-a716-446655440031",
  "segment_id": "550e8400-e29b-41d4-a716-446655440042",
  "document_display_name": "权限设计文档",
  "location": { "char_span": { "start": 12, "end": 40 } },
  "minimal_excerpt": "可见性优先于所有权参与 READ 判定。",
  "scores": [
    { "score_kind": "rerank", "value": 0.91, "rank": 0 }
  ],
  "source_updated_at": "2026-08-03T09:00:00Z",
  "retrieved_at": "2026-08-04T12:00:00Z",
  "access_scope": "internal"
}
